{"status":"PASS","digest":"d8f9301478b8236d6776faae9c99949c4703b5aee6357f816be2decea74d5cf8","findings":[],"summary":"Verified modal Tab/Shift+Tab containment, Escape dismissal, opener focus restoration, and filtered-edit fallback. Rule 9 drove the dialog key handler and opener refs with fallback focus; this follows Vercel’s interaction-handler guidance. Fresh checks passed: lint, typecheck, 27 unit tests, docs, build, and 13 E2E tests with 5 expected skips. Fallow structural gate passed; seven complexity findings remain as documented non-blocking debt."}